<?xml version="1.0" encoding="UTF-8"?>

<!DOCTYPE frame2-config PUBLIC
  "-//Megatome Technologies//DTD Frame2 Configuration 1.0//EN"
  "http://frame2.sourceforge.net/dtds/frame2-config_1_0.dtd">

<frame2-config>
   <global-forwards>
   </global-forwards>
   <events>
   </events>
   <event-mappings>
   </event-mappings>
   <event-handlers>
   </event-handlers>
   <plugins>
   </plugins>
   <request-processors>
     <soap-request-processor type="org.megatome.frame2.front.RequestProcessorNoImple"/>
   </request-processors>
</frame2-config>
