<?xml version="1.0" encoding="UTF-8"?>

<!DOCTYPE frame2-config PUBLIC
  "-//Megatome Technologies//DTD Frame2 Configuration 1.0//EN"
  "http://frame2.sourceforge.net/dtds/frame2-config_1_0.dtd">

<frame2-config>
  <global-forwards>
    <forward name="orderResult" type="XMLResource" path="key1"/>
    <forward name="ack" type="XMLResponder" path="org.megatome.frame2.front.AckResponder"/>
    <forward name="ev13forward" type="event" path="event2"/>
    <forward name="view4" type="HTMLResource" path="/view4.jsp"/>
    <forward name="view4" type="XMLResource" path="testXmlResource"/>
    <forward name="pass" type="XMLResource" path="passthruResponse"/>
  </global-forwards>
  <events>
    <event name="purchaseOrder" resolveAs="parent"
           type="org.megatome.frame2.jaxbgen.impl.PurchaseOrderImpl"/>
    <event name="POResponderOrder" resolveAs="parent"
           type="org.megatome.frame2.jaxbgen.impl.PurchaseOrderImpl"/>
    <event name="POTestChildren" resolveAs="children"
           type="org.megatome.frame2.jaxbgen.impl.PurchaseOrderImpl"/>
    <event name="comment" resolveAs="parent"
           type="org.megatome.frame2.jaxbgen.impl.CommentImpl"/>
    <event name="event2"
           type="org.megatome.frame2.front.Event2"/>
    <event name="POTestChildrenMixedData" resolveAs="children"
           type="org.megatome.frame2.jaxbgen.impl.PurchaseOrderImpl"/>
    <event name="passthruEvent" resolveAs="passthru"
           type="org.megatome.frame2.event.xml.SimplePassthruEvent"/>
  </events>
  <event-mappings>
    <event-mapping eventName="purchaseOrder"
                   validate="true">
      <handler name="purchaseOrderHandler"/>
      <security>
        <role name="admin"/>
        <role name="guest"/>
      </security>
    </event-mapping>
    <event-mapping eventName="POResponderOrder"
                   validate="true">
      <handler name="POResponderHandler"/>
      <view type="XML" forwardName="ack"/>
    </event-mapping>
    <event-mapping eventName="POTestChildrenMixedData"
                   validate="true">
      <handler name="POResponderHandler"/>
      <view type="XML" forwardName="ack"/>
    </event-mapping>
    <event-mapping eventName="POTestChildren"
                   validate="true">
      <handler name="POResponderHandler"/>
      <view type="XML" forwardName="ack"/>
    </event-mapping>
    <event-mapping eventName="comment"
                   validate="false">
      <handler name="handlerThrowingException"/>
      <view type="XML" forwardName="ack"/>
    </event-mapping>
    <event-mapping eventName="event2"
                   inputView="view1" validate="true">
      <handler name="ev1handler1"/>
      <handler name="ev2handler1"/>
      <view type="Both" forwardName="view4"/>
      <security>
        <role name="admin"/>
        <role name="sales"/>
        <role name="manager"/>
      </security>
    </event-mapping>
    <event-mapping eventName="passthruEvent"
                   inputView="view1" validate="true">
      <handler name="passthruEventHandler"/>
      <view type="XML" forwardName="pass"/>
    </event-mapping>
  </event-mappings>
  <event-handlers>
    <event-handler name="purchaseOrderHandler"
                   type="org.megatome.frame2.front.PurchaseOrderHandler"/>
    <event-handler name="POResponderHandler"
                   type="org.megatome.frame2.front.POResponderHandler"/>
    <event-handler name="handlerThrowingException"
                   type="org.megatome.frame2.front.HandlerThrowingException">
      <forward name="local14" type="XMLResource" path="testclass1"/>
      <forward name="local14" type="HTMLResource" path="test.jsp"/>
      <forward name="listResponder" type="XMLResponder" path="testLocalListResponder"/>
    </event-handler>
    <event-handler name="ev1handler1"
                   type="org.megatome.frame2.front.Ev1handler1">
      <init-param name="parm1" value="val111"/>
      <init-param name="parm2" value="val112"/>
      <forward name="ev1forward1" type="HTMLResource" path="/ev1.jsp"/>
    </event-handler>
    <event-handler name="ev2handler1"
                   type="org.megatome.frame2.front.Ev2handler1">
      <forward name="ev2forward1" type="HTMLResource" path="/ev2.jsp"/>
      <init-param name="parm1" value="val211"/>
      <init-param name="parm2" value="val212"/>
    </event-handler>
    <event-handler name="passthruEventHandler"
                   type="org.megatome.frame2.front.PassthruTestEventHandler"/>
  </event-handlers>
  <exceptions>
    <exception requestKey="exception"
               type="org.megatome.frame2.front.HandlerExceptionTest">
      <view type="Both" forwardName="ev13forward"/>
    </exception>
  </exceptions>
</frame2-config>
